{
  "$schema": "https://agent-project-os.org/schemas/evidence-v1.schema.json",
  "acceptance_status": "accepted",
  "created_at": "2026-08-14T00:09:00Z",
  "created_by": "agent:codex",
  "evidence_id": "contracts-e2",
  "grade": "E2",
  "kind": "validation",
  "protocol_version": "1.0",
  "runtime_identity": {"client_version": "example", "model_id": "example-model-a", "runtime": "codex"},
  "summary": "Synthetic contract examples passed.",
  "task_id": "contract-v2",
  "verification": {
    "command": "python -m unittest",
    "duration_ms": 12,
    "executed_at": "2026-08-14T00:09:00Z",
    "executor": "agent-project",
    "exit_code": 0,
    "output_sha256": "bbbbbbbbbbbbbbbbbbbbbbbbbbbbbbbbbbbbbbbbbbbbbbbbbbbbbbbbbbbbbbbb",
    "result": "passed"
  }
}
