{
  "$schema": "https://agent-project-os.org/schemas/evidence-v1.schema.json",
  "acceptance_status": "accepted",
  "created_at": "2026-08-14T00:35:00Z",
  "created_by": "agent:claude-code",
  "evidence_id": "service-e2",
  "grade": "E2",
  "kind": "validation",
  "protocol_version": "1.0",
  "runtime_identity": {"client_version": "example", "model_id": "example-model-b", "runtime": "claude-code"},
  "summary": "Synthetic Node.js service tests passed.",
  "task_id": "consume-orders-v2",
  "verification": {
    "command": "node --test",
    "duration_ms": 22,
    "executed_at": "2026-08-14T00:35:00Z",
    "executor": "agent-project",
    "exit_code": 0,
    "output_sha256": "cccccccccccccccccccccccccccccccccccccccccccccccccccccccccccccccc",
    "result": "passed"
  }
}
