{
  "$schema": "https://agent-project-os.org/schemas/evidence-v1.schema.json",
  "acceptance_status": "accepted",
  "created_at": "2026-08-14T00:39:00Z",
  "created_by": "human:example",
  "evidence_id": "service-e3",
  "grade": "E3",
  "kind": "consumer_acceptance",
  "protocol_version": "1.0",
  "receipt_ref": "orders-v2-receipt",
  "runtime_identity": {"client_version": "manual", "runtime": "manual"},
  "summary": "The service accepted the identified orders@2 artifact.",
  "task_id": "consume-orders-v2",
  "verification": null
}
