{
  "$schema": "https://agent-project-os.org/schemas/evidence-v1.schema.json",
  "acceptance_status": "accepted",
  "created_at": "2026-08-14T09:23:48Z",
  "created_by": "agent:codex",
  "evidence_id": "real-client-smokes-e1",
  "grade": "E1",
  "kind": "release_artifact",
  "protocol_version": "1.0",
  "runtime_identity": {
    "client_version": "desktop",
    "runtime": "codex"
  },
  "summary": "Bounded synthetic Codex and Claude Code smoke results are recorded in release/smoke-results-v0.1.json; DSH remains keyless preview.",
  "task_id": "v0.1-release-candidate",
  "verification": null
}
